<?xml version="1.0" encoding="UTF-8"?>
<classifieds xmlns:xsi="http://www.w3.org/2001/XMLSchema-instance" xsi:noNamespaceSchemaLocation="file:///D:/work/master/webservices/20223003/XSD/classifieds.xsd">
	<flat>
		<type>2bhk</type>
		<facing>east</facing>
		<rental-amount>18000</rental-amount>
		<square-feet>1400</square-feet>
		<floor>10</floor>
	</flat>
	<house>
		<type>villa</type>
		<facing>north-east</facing>
		<rental-amount>75000</rental-amount>
		<no-of-floors>2</no-of-floors>
		<square-yards>4000</square-yards>
	</house>
</classifieds>
